{
  "$schema": "./pack.schema.json",
  "$description": "Ghana pack. Overrides core colour tokens with the national colours and carries official-website banner strings.",
  "$extensions": {
    "afrigov": {
      "code": "gh",
      "country": "Ghana",
      "government": "Republic of Ghana",
      "domain": ".gov.gh",
      "flag": ["{official.red}", "{official.gold}", "{official.green}"],
      "flagDirection": "column",
      "flagSvg": "gh.svg",
      "strings": {
        "en": {
          "banner": "An official website of the Government of Ghana",
          "banner-how": "How you know this is official",
          "banner-domain": "Official websites use .gov.gh",
          "banner-secure": "Secure .gov.gh websites use HTTPS"
        },
        "ak": {
          "banner": "Ghana aban no wɛbsaet a wɔagye atom.",
          "banner-how": "Wobɛyɛ dɛn ahu sɛ eyi yɛ aban de?",
          "banner-domain": "Aban wɛbsaet ahorow de .gov.gh na ɛdi dwuma.",
          "banner-secure": "Wɛbsaet a ahobammɔ wɔ mu a ɛde .gov.gh no de HTTPS na ɛdi dwuma."
        },
        "ee": {
          "banner": null,
          "$todo": "Ewe translation wanted. Open a PR."
        }
      },
      "currency": {
        "code": "GHS",
        "symbol": "GH₵",
        "name": "cedis",
        "hint": "In Ghana cedis"
      },
      "id": {
        "name": "Ghana Card number",
        "short": "Ghana Card number",
        "document": "Ghana Card",
        "hint": "On the front of your Ghana Card, like GHA-123456789-0",
        "length": 15,
        "pattern": "GHA-[0-9]{9}-[0-9]",
        "authority": "the National Identification Authority"
      },
      "regions": {
        "label": "Region",
        "choose": "Choose a region",
        "items": [
          "Ahafo",
          "Ashanti",
          "Bono",
          "Bono East",
          "Central",
          "Eastern",
          "Greater Accra",
          "North East",
          "Northern",
          "Oti",
          "Savannah",
          "Upper East",
          "Upper West",
          "Volta",
          "Western",
          "Western North"
        ],
        "sub": {
          "label": "District",
          "choose": "Choose a district",
          "items": {
            "Ahafo": ["Asunafo North", "Tano North", "Tano South"],
            "Ashanti": ["Kumasi Metropolitan", "Obuasi Municipal", "Ejisu"],
            "Bono": ["Sunyani Municipal", "Dormaa Central", "Wenchi"],
            "Bono East": ["Techiman Municipal", "Kintampo North", "Nkoranza South"],
            "Central": ["Cape Coast Metropolitan", "Mfantseman", "Komenda-Edina-Eguafo-Abirem"],
            "Eastern": ["New Juaben South", "Kwahu West", "Suhum"],
            "Greater Accra": ["Accra Metropolitan", "Tema Metropolitan", "Ga East", "Ledzokuku"],
            "North East": ["East Mamprusi", "West Mamprusi", "Chereponi"],
            "Northern": ["Tamale Metropolitan", "Savelugu", "Yendi"],
            "Oti": ["Krachi East", "Nkwanta South", "Jasikan"],
            "Savannah": ["West Gonja", "East Gonja", "Bole"],
            "Upper East": ["Bolgatanga Municipal", "Bawku Municipal", "Kassena-Nankana Municipal"],
            "Upper West": ["Wa Municipal", "Lawra", "Sissala East"],
            "Volta": ["Ho Municipal", "Keta", "Hohoe"],
            "Western": ["Sekondi-Takoradi", "Tarkwa-Nsuaem", "Ahanta West"],
            "Western North": ["Sefwi Wiawso", "Aowin", "Bibiani-Anhwiaso-Bekwai"]
          }
        }
      },
      "phone": {
        "code": "+233",
        "example": "024 123 4567",
        "hint": "We will send a code by SMS. For example, 024 123 4567",
        "length": 10
      },
      "examples": {
        "timezone": "Greenwich Mean Time",
        "refPrefix": "GH"
      }
    }
  },
  "official": {
    "$type": "color",
    "$description": "Flag of Ghana: red, gold and green horizontal bands with a black star. Values as published by the Ghana Government Portal brand assets and widely reproduced (Wikipedia, Flags of the World). Gold fails WCAG AA as text, so it is accent only; the build would derive a deeper gold if it were ever made primary.",
    "red": {
      "$value": "#ce1126"
    },
    "gold": {
      "$value": "#fcd116"
    },
    "green": {
      "$value": "#006b3f"
    },
    "black": {
      "$value": "#000000"
    }
  },
  "color": {
    "$type": "color",
    "primary": {
      "$value": "{official.green}"
    },
    "accent": {
      "$value": "{official.gold}"
    }
  }
}
