{
  "$schema": "./pack.schema.json",
  "$description": "Senegal pack. First francophone pack: French is the default language for banner strings, and the currency symbol follows the amount. Overrides core colour tokens with the national colours.",
  "$extensions": {
    "afrigov": {
      "code": "sn",
      "country": "Senegal",
      "government": "République du Sénégal",
      "domain": ".gouv.sn",
      "language": "fr",
      "flag": ["{official.green}", "{official.yellow}", "{official.red}"],
      "flagSvg": "sn.svg",
      "flagDirection": "row",
      "strings": {
        "fr": {
          "banner": "Un site officiel de la République du Sénégal",
          "banner-how": "Comment reconnaître un site officiel ?",
          "banner-domain": "Le domaine .gouv.sn permet d’identifier les sites de l’administration sénégalaise.",
          "banner-secure": "Vérifiez que la connexion utilise HTTPS avant de transmettre des informations."
        },
        "en": {
          "banner": "An official website of the Republic of Senegal",
          "banner-how": "How you know this is official",
          "banner-domain": "Official websites use .gouv.sn",
          "banner-secure": "Secure .gouv.sn websites use HTTPS"
        },
        "wo": {
          "banner": null,
          "$todo": "Wolof translation wanted. Open a PR."
        }
      },
      "currency": {
        "code": "XOF",
        "symbol": "F CFA",
        "position": "suffix",
        "locale": "fr",
        "name": "francs CFA",
        "hint": "En francs CFA"
      },
      "id": {
        "name": "Numéro d'identification nationale",
        "short": "NIN",
        "document": "Carte nationale d'identité CEDEAO",
        "hint": "13 ou 14 chiffres, au verso de votre carte d'identité CEDEAO",
        "length": 14,
        "pattern": "[0-9]{13,14}",
        "authority": "la Direction de l'automatisation des fichiers"
      },
      "regions": {
        "label": "Région",
        "choose": "Choisissez une région",
        "items": ["Dakar", "Thiès", "Saint-Louis", "Ziguinchor", "Kaolack", "Diourbel"],
        "sub": {
          "label": "Département",
          "choose": "Choisissez un département",
          "items": {
            "Dakar": ["Dakar", "Pikine", "Guédiawaye", "Rufisque"],
            "Thiès": ["Thiès", "Mbour", "Tivaouane"],
            "Saint-Louis": ["Saint-Louis", "Dagana", "Podor"],
            "Ziguinchor": ["Ziguinchor", "Bignona", "Oussouye"],
            "Kaolack": ["Kaolack", "Nioro du Rip", "Guinguinéo"],
            "Diourbel": ["Diourbel", "Bambey", "Mbacké"]
          }
        }
      },
      "phone": {
        "code": "+221",
        "example": "77 123 45 67",
        "hint": "Nous vous enverrons un code par SMS. Par exemple, 77 123 45 67",
        "length": 9
      },
      "examples": {
        "timezone": "heure de Dakar",
        "refPrefix": "SN"
      }
    }
  },
  "official": {
    "$type": "color",
    "$description": "Flag of Senegal: green, yellow and red vertical bands with a green star. Values as commonly published (Wikipedia, Flags of the World); no official government colour specification was found. Green fails WCAG AA on the grey panel background, so the build derives a deeper green for text.",
    "green": {
      "$value": "#00853f"
    },
    "yellow": {
      "$value": "#fdef42"
    },
    "red": {
      "$value": "#e31b23"
    }
  },
  "color": {
    "$type": "color",
    "primary": {
      "$value": "{official.green}"
    },
    "accent": {
      "$value": "{official.yellow}"
    }
  }
}
