{
  "$schema": "./pack.schema.json",
  "$description": "Nigeria pack. Overrides core colour tokens with the national colours and carries official-website banner strings.",
  "$extensions": {
    "afrigov": {
      "code": "ng",
      "country": "Nigeria",
      "government": "Federal Republic of Nigeria",
      "domain": ".gov.ng",
      "flag": ["{official.green}", "{official.white}", "{official.green}"],
      "flagDirection": "row",
      "strings": {
        "en": {
          "banner": "An official website of the Federal Republic of Nigeria",
          "banner-how": "How you know this is official",
          "banner-domain": "Official websites use .gov.ng",
          "banner-secure": "Secure .gov.ng websites use HTTPS"
        },
        "ha": {
          "banner": null,
          "$todo": "Hausa translation wanted. Open a PR."
        },
        "yo": {
          "banner": null,
          "$todo": "Yoruba translation wanted. Open a PR."
        },
        "ig": {
          "banner": null,
          "$todo": "Igbo translation wanted. Open a PR."
        }
      },
      "currency": {
        "code": "NGN",
        "symbol": "₦",
        "name": "naira",
        "hint": "In naira"
      },
      "id": {
        "name": "National Identification Number",
        "short": "NIN",
        "document": "NIN slip",
        "hint": "11 digits, on your NIN slip",
        "length": 11,
        "pattern": "[0-9]{11}",
        "authority": "NIMC"
      },
      "regions": {
        "label": "State",
        "choose": "Choose a state",
        "items": ["Abia", "Adamawa", "Akwa Ibom", "Anambra", "Lagos", "Kano"],
        "sub": {
          "label": "Local government area",
          "choose": "Choose a local government area",
          "items": {
            "Abia": ["Aba North", "Aba South", "Umuahia North"],
            "Adamawa": ["Yola North", "Yola South", "Mubi North"],
            "Akwa Ibom": ["Uyo", "Eket", "Ikot Ekpene"],
            "Anambra": ["Awka South", "Onitsha North", "Nnewi North"],
            "Lagos": ["Ikeja", "Surulere", "Eti-Osa", "Alimosho", "Ikorodu"],
            "Kano": ["Nassarawa", "Dala", "Fagge", "Tarauni"]
          }
        }
      },
      "phone": {
        "code": "+234",
        "example": "0803 000 0000",
        "hint": "We will send a code by SMS. For example, 0803 000 0000",
        "length": 11
      },
      "examples": {
        "timezone": "West Africa Time",
        "refPrefix": "NG"
      }
    }
  },
  "official": {
    "$type": "color",
    "$description": "Exact national colours. Used for the flag stripe and decoration only. Text and control colours are derived from these by the build if they fail WCAG AA.",
    "green": {
      "$value": "#008751"
    },
    "white": {
      "$value": "#ffffff"
    }
  },
  "color": {
    "$type": "color",
    "primary": {
      "$value": "{official.green}"
    },
    "accent": {
      "$value": "{official.green}"
    }
  }
}
